{
  "id": "standard-gear-chest",
  "name": "Standard Gear Chest",
  "kind": "gear",
  "tier": "standard",
  "priceR": 0.5,
  "subtypes": [
    "weapon",
    "armor",
    "trinket"
  ],
  "oddsByBand": [
    {
      "centreGrade": "F",
      "table": {
        "F": 56,
        "E": 25,
        "D": 14,
        "C": 4,
        "B": 1
      }
    },
    {
      "centreGrade": "E",
      "table": {
        "E": 56,
        "D": 25,
        "C": 14,
        "B": 4,
        "A": 1
      }
    },
    {
      "centreGrade": "D",
      "table": {
        "D": 56,
        "C": 25,
        "B": 14,
        "A": 4,
        "S": 1
      }
    },
    {
      "centreGrade": "C",
      "table": {
        "C": 56,
        "B": 25,
        "A": 14,
        "S": 4,
        "SS": 1
      }
    },
    {
      "centreGrade": "B",
      "table": {
        "B": 56,
        "A": 25,
        "S": 14,
        "SS": 5,
        "God": 0
      }
    },
    {
      "centreGrade": "A",
      "table": {
        "A": 56,
        "S": 25,
        "SS": 19
      }
    }
  ],
  "pity": {
    "plusOneWithin": 10,
    "plusTwoWithin": 40
  },
  "bagWithoutReplacement": false,
  "tomeTiers": null,
  "dupeRule": "salvage",
  "divineShardChance": 0
}
